18:52:22.484409 40:61:86:9a:f1:f5 > 00:1a:8c:15:f9:80, ethertype IPv4 (0x0800), length 997: 192.168.3.131.57011 > 72.14.213.138.80: Flags [P.], seq 2542412440:2542413383, ack 2428019935, win 16288, length 943: HTTP: GET /complete/search?client=chrome&hl=en-US&q=cr HTTP/1.1
18:52:22.514250 00:1a:8c:15:f9:80 > 40:61:86:9a:f1:f5, ethertype IPv4 (0x0800), length 440: 72.14.213.138.80 > 192.168.3.131.57011: Flags [P.], seq 1:387, ack 943, win 947, length 386: HTTP: HTTP/1.1 200 OK
18:52:22.708292 40:61:86:9a:f1:f5 > 00:1a:8c:15:f9:80, ethertype IPv4 (0x0800), length 66: 192.168.3.131.55950 > 72.14.213.102.80: Flags [S], seq 1562033828, win 8192, options [mss 1460,nop,wscale 2,nop,nop,sackOK], length 0
18:52:22.713832 40:61:86:9a:f1:f5 > 00:1a:8c:15:f9:80, ethertype IPv4 (0x0800), length 54: 192.168.3.131.57011 > 72.14.213.138.80: Flags [.], ack 387, win 16192, length 0
18:52:22.727058 00:1a:8c:15:f9:80 > 40:61:86:9a:f1:f5, ethertype IPv4 (0x0800), length 66: 72.14.213.102.80 > 192.168.3.131.55950: Flags [S.], seq 2992713107, ack 1562033829, win 5720, options [mss 1430,nop,nop,sackOK,nop,wscale 6], length 0
18:52:22.727105 40:61:86:9a:f1:f5 > 00:1a:8c:15:f9:80, ethertype IPv4 (0x0800), length 54: 192.168.3.131.55950 > 72.14.213.102.80: Flags [.], ack 1, win 16445, length 0
18:52:22.727459 40:61:86:9a:f1:f5 > 00:1a:8c:15:f9:80, ethertype IPv4 (0x0800), length 998: 192.168.3.131.55950 > 72.14.213.102.80: Flags [P.], seq 1:945, ack 1, win 16445, length 944: HTTP: GET /complete/search?client=chrome&hl=en-US&q=msn HTTP/1.1
18:52:22.747390 40:61:86:9a:f1:f5 > 00:1a:8c:15:f9:80, ethertype IPv4 (0x0800), length 54: 192.168.3.131.55950 > 72.14.213.102.80: Flags [F.], seq 945, ack 1, win 16445, length 0
18:52:22.748483 00:1a:8c:15:f9:80 > 40:61:86:9a:f1:f5, ethertype IPv4 (0x0800), length 60: 72.14.213.102.80 > 192.168.3.131.55950: Flags [.], ack 945, win 119, length 0
18:52:22.761080 00:1a:8c:15:f9:80 > 40:61:86:9a:f1:f5, ethertype IPv4 (0x0800), length 541: 72.14.213.102.80 > 192.168.3.131.55950: Flags [P.], seq 1:488, ack 945, win 119, length 487: HTTP: HTTP/1.1 200 OK
18:52:22.761168 40:61:86:9a:f1:f5 > 00:1a:8c:15:f9:80, ethertype IPv4 (0x0800), length 54: 192.168.3.131.55950 > 72.14.213.102.80: Flags [R.], seq 946, ack 488, win 0, length 0
18:52:22.766777 00:1a:8c:15:f9:80 > 40:61:86:9a:f1:f5, ethertype IPv4 (0x0800), length 60: 72.14.213.102.80 > 192.168.3.131.55950: Flags [F.], seq 488, ack 946, win 119, length 0
18:52:22.928128 40:61:86:9a:f1:f5 > 00:1a:8c:15:f9:80, ethertype IPv4 (0x0800), length 66: 192.168.3.131.52152 > 72.14.213.147.443: Flags [S], seq 416920696, win 8192, options [mss 1460,nop,wscale 2,nop,nop,sackOK], length 0
18:52:22.946723 00:1a:8c:15:f9:80 > 40:61:86:9a:f1:f5, ethertype IPv4 (0x0800), length 66: 72.14.213.147.443 > 192.168.3.131.52152: Flags [S.], seq 4005169627, ack 416920697, win 5720, options [mss 1430,nop,nop,sackOK,nop,wscale 6], length 0
18:52:22.946812 40:61:86:9a:f1:f5 > 00:1a:8c:15:f9:80, ethertype IPv4 (0x0800), length 54: 192.168.3.131.52152 > 72.14.213.147.443: Flags [.], ack 1, win 16445, length 0
18:52:22.947575 40:61:86:9a:f1:f5 > 00:1a:8c:15:f9:80, ethertype IPv4 (0x0800), length 231: 192.168.3.131.52152 > 72.14.213.147.443: Flags [P.], seq 1:178, ack 1, win 16445, length 177
18:52:22.966283 00:1a:8c:15:f9:80 > 40:61:86:9a:f1:f5, ethertype IPv4 (0x0800), length 60: 72.14.213.147.443 > 192.168.3.131.52152: Flags [.], ack 178, win 107, length 0
18:52:22.967705 00:1a:8c:15:f9:80 > 40:61:86:9a:f1:f5, ethertype IPv4 (0x0800), length 1484: 72.14.213.147.443 > 192.168.3.131.52152: Flags [.], seq 1:1431, ack 178, win 107, length 1430
18:52:22.968530 00:1a:8c:15:f9:80 > 40:61:86:9a:f1:f5, ethertype IPv4 (0x0800), length 345: 72.14.213.147.443 > 192.168.3.131.52152: Flags [P.], seq 1431:1722, ack 178, win 107, length 291
18:52:22.968559 40:61:86:9a:f1:f5 > 00:1a:8c:15:f9:80, ethertype IPv4 (0x0800), length 54: 192.168.3.131.52152 > 72.14.213.147.443: Flags [.], ack 1722, win 16445, length 0
18:52:22.972193 40:61:86:9a:f1:f5 > 00:1a:8c:15:f9:80, ethertype IPv4 (0x0800), length 329: 192.168.3.131.52152 > 72.14.213.147.443: Flags [P.], seq 178:453, ack 1722, win 16445, length 275
18:52:22.993256 00:1a:8c:15:f9:80 > 40:61:86:9a:f1:f5, ethertype IPv4 (0x0800), length 280: 72.14.213.147.443 > 192.168.3.131.52152: Flags [P.], seq 1722:1948, ack 453, win 123, length 226
18:52:22.994071 00:1a:8c:15:f9:80 > 40:61:86:9a:f1:f5, ethertype IPv4 (0x0800), length 99: 72.14.213.147.443 > 192.168.3.131.52152: Flags [P.], seq 1948:1993, ack 453, win 123, length 45
18:52:22.994072 00:1a:8c:15:f9:80 > 40:61:86:9a:f1:f5, ethertype IPv4 (0x0800), length 60: 72.14.213.147.443 > 192.168.3.131.52152: Flags [.], ack 2279, win 213, length 0
18:52:22.994110 40:61:86:9a:f1:f5 > 00:1a:8c:15:f9:80, ethertype IPv4 (0x0800), length 54: 192.168.3.131.52152 > 72.14.213.147.443: Flags [.], ack 1993, win 16377, length 0
18:52:23.103559 40:61:86:9a:f1:f5 > 00:1a:8c:15:f9:80, ethertype IPv4 (0x0800), length 66: 192.168.3.131.55953 > 65.55.206.209.80: Flags [S], seq 2940642208, win 8192, options [mss 1460,nop,wscale 2,nop,nop,sackOK], length 0
18:52:23.134962 00:1a:8c:15:f9:80 > 40:61:86:9a:f1:f5, ethertype IPv4 (0x0800), length 440: 72.14.213.147.443 > 192.168.3.131.52152: Flags [P.], seq 1993:2379, ack 2279, win 213, length 386
18:52:23.135841 00:1a:8c:15:f9:80 > 40:61:86:9a:f1:f5, ethertype IPv4 (0x0800), length 1484: 72.14.213.147.443 > 192.168.3.131.52152: Flags [.], seq 2379:3809, ack 2279, win 213, length 1430
18:52:23.135843 00:1a:8c:15:f9:80 > 40:61:86:9a:f1:f5, ethertype IPv4 (0x0800), length 100: 72.14.213.147.443 > 192.168.3.131.52152: Flags [P.], seq 3809:3855, ack 2279, win 213, length 46
18:52:23.135887 40:61:86:9a:f1:f5 > 00:1a:8c:15:f9:80, ethertype IPv4 (0x0800), length 54: 192.168.3.131.52152 > 72.14.213.147.443: Flags [.], ack 3855, win 16445, length 0
18:52:23.137376 00:1a:8c:15:f9:80 > 40:61:86:9a:f1:f5, ethertype IPv4 (0x0800), length 1484: 72.14.213.147.443 > 192.168.3.131.52152: Flags [.], seq 3855:5285, ack 2279, win 213, length 1430
18:52:23.137378 00:1a:8c:15:f9:80 > 40:61:86:9a:f1:f5, ethertype IPv4 (0x0800), length 1085: 72.14.213.147.443 > 192.168.3.131.52152: Flags [P.], seq 5285:6316, ack 2279, win 213, length 1031
18:52:23.137428 40:61:86:9a:f1:f5 > 00:1a:8c:15:f9:80, ethertype IPv4 (0x0800), length 54: 192.168.3.131.52152 > 72.14.213.147.443: Flags [.], ack 6316, win 16445, length 0
18:52:23.163583 00:1a:8c:15:f9:80 > 40:61:86:9a:f1:f5, ethertype IPv4 (0x0800), length 1484: 72.14.213.147.443 > 192.168.3.131.52152: Flags [.], seq 6316:7746, ack 2279, win 213, length 1430
18:52:23.163586 00:1a:8c:15:f9:80 > 40:61:86:9a:f1:f5, ethertype IPv4 (0x0800), length 100: 72.14.213.147.443 > 192.168.3.131.52152: Flags [P.], seq 7746:7792, ack 2279, win 213, length 46
18:52:23.163645 40:61:86:9a:f1:f5 > 00:1a:8c:15:f9:80, ethertype IPv4 (0x0800), length 54: 192.168.3.131.52152 > 72.14.213.147.443: Flags [.], ack 7792, win 16445, length 0
18:52:23.164402 00:1a:8c:15:f9:80 > 40:61:86:9a:f1:f5, ethertype IPv4 (0x0800), length 1484: 72.14.213.147.443 > 192.168.3.131.52152: Flags [.], seq 7792:9222, ack 2279, win 213, length 1430
18:52:23.164403 00:1a:8c:15:f9:80 > 40:61:86:9a:f1:f5, ethertype IPv4 (0x0800), length 684: 72.14.213.147.443 > 192.168.3.131.52152: Flags [P.], seq 9222:9852, ack 2279, win 213, length 630
18:52:23.164426 40:61:86:9a:f1:f5 > 00:1a:8c:15:f9:80, ethertype IPv4 (0x0800), length 54: 192.168.3.131.52152 > 72.14.213.147.443: Flags [.], ack 9852, win 16445, length 0
18:52:23.168321 00:1a:8c:15:f9:80 > 40:61:86:9a:f1:f5, ethertype IPv4 (0x0800), length 1484: 72.14.213.147.443 > 192.168.3.131.52152: Flags [.], seq 9852:11282, ack 2279, win 213, length 1430
18:52:23.169073 00:1a:8c:15:f9:80 > 40:61:86:9a:f1:f5, ethertype IPv4 (0x0800), length 1484: 72.14.213.147.443 > 192.168.3.131.52152: Flags [.], seq 11282:12712, ack 2279, win 213, length 1430
18:52:23.169074 00:1a:8c:15:f9:80 > 40:61:86:9a:f1:f5, ethertype IPv4 (0x0800), length 198: 72.14.213.147.443 > 192.168.3.131.52152: Flags [P.], seq 12712:12856, ack 2279, win 213, length 144
18:52:23.169106 40:61:86:9a:f1:f5 > 00:1a:8c:15:f9:80, ethertype IPv4 (0x0800), length 54: 192.168.3.131.52152 > 72.14.213.147.443: Flags [.], ack 12856, win 16445, length 0
18:52:23.169874 00:1a:8c:15:f9:80 > 40:61:86:9a:f1:f5, ethertype IPv4 (0x0800), length 863: 72.14.213.147.443 > 192.168.3.131.52152: Flags [P.], seq 12856:13665, ack 2279, win 213, length 809
18:52:23.182327 00:1a:8c:15:f9:80 > 40:61:86:9a:f1:f5, ethertype IPv4 (0x0800), length 60: 65.55.206.209.80 > 192.168.3.131.55953: Flags [S.], seq 828418081, ack 2940642209, win 8190, options [mss 1460], length 0
18:52:23.182400 40:61:86:9a:f1:f5 > 00:1a:8c:15:f9:80, ethertype IPv4 (0x0800), length 54: 192.168.3.131.55953 > 65.55.206.209.80: Flags [.], ack 1, win 64240, length 0
18:52:23.182793 40:61:86:9a:f1:f5 > 00:1a:8c:15:f9:80, ethertype IPv4 (0x0800), length 515: 192.168.3.131.55953 > 65.55.206.209.80: Flags [P.], seq 1:462, ack 1, win 64240, length 461: HTTP: GET / HTTP/1.1
18:52:23.194040 40:61:86:9a:f1:f5 > 00:1a:8c:15:f9:80, ethertype IPv4 (0x0800), length 303: 192.168.3.131.52152 > 72.14.213.147.443: Flags [P.], seq 2279:2528, ack 13665, win 16242, length 249
18:52:23.210582 00:1a:8c:15:f9:80 > 40:61:86:9a:f1:f5, ethertype IPv4 (0x0800), length 1484: 72.14.213.147.443 > 192.168.3.131.52152: Flags [.], seq 13665:15095, ack 2279, win 213, length 1430
18:52:23.211397 00:1a:8c:15:f9:80 > 40:61:86:9a:f1:f5, ethertype IPv4 (0x0800), length 1484: 72.14.213.147.443 > 192.168.3.131.52152: Flags [.], seq 15095:16525, ack 2279, win 213, length 1430