13:08:50.190797 40:61:86:04:49:22 > 00:1a:8c:71:57:4d, ethertype IPv4 (0x0800), length 997: 192.168.3.131.57011 > 72.14.213.160.80: Flags [P.], seq 2542412440:2542413383, ack 2428019935, win 16288, length 943: HTTP: GET /complete/search?client=chrome&hl=en-US&q=cr HTTP/1.1
13:08:50.220394 00:1a:8c:71:57:4d > 40:61:86:04:49:22, ethertype IPv4 (0x0800), length 440: 72.14.213.160.80 > 192.168.3.131.57011: Flags [P.], seq 1:387, ack 943, win 947, length 386: HTTP: HTTP/1.1 200 OK
13:08:50.414568 40:61:86:04:49:22 > 00:1a:8c:71:57:4d, ethertype IPv4 (0x0800), length 66: 192.168.3.131.55950 > 72.14.213.0.80: Flags [S], seq 1562033828, win 8192, options [mss 1460,nop,wscale 2,nop,nop,sackOK], length 0
13:08:50.419978 40:61:86:04:49:22 > 00:1a:8c:71:57:4d, ethertype IPv4 (0x0800), length 54: 192.168.3.131.57011 > 72.14.213.160.80: Flags [.], ack 387, win 16192, length 0
13:08:50.433608 00:1a:8c:71:57:4d > 40:61:86:04:49:22, ethertype IPv4 (0x0800), length 66: 72.14.213.0.80 > 192.168.3.131.55950: Flags [S.], seq 2992713107, ack 1562033829, win 5720, options [mss 1430,nop,nop,sackOK,nop,wscale 6], length 0
13:08:50.434038 40:61:86:04:49:22 > 00:1a:8c:71:57:4d, ethertype IPv4 (0x0800), length 54: 192.168.3.131.55950 > 72.14.213.0.80: Flags [.], ack 1, win 16445, length 0
13:08:50.434797 40:61:86:04:49:22 > 00:1a:8c:71:57:4d, ethertype IPv4 (0x0800), length 998: 192.168.3.131.55950 > 72.14.213.0.80: Flags [P.], seq 1:945, ack 1, win 16445, length 944: HTTP: GET /complete/search?client=chrome&hl=en-US&q=msn HTTP/1.1
13:08:50.453640 40:61:86:04:49:22 > 00:1a:8c:71:57:4d, ethertype IPv4 (0x0800), length 54: 192.168.3.131.55950 > 72.14.213.0.80: Flags [F.], seq 945, ack 1, win 16445, length 0
13:08:50.455456 00:1a:8c:71:57:4d > 40:61:86:04:49:22, ethertype IPv4 (0x0800), length 60: 72.14.213.0.80 > 192.168.3.131.55950: Flags [.], ack 945, win 119, length 0
13:08:50.468470 00:1a:8c:71:57:4d > 40:61:86:04:49:22, ethertype IPv4 (0x0800), length 541: 72.14.213.0.80 > 192.168.3.131.55950: Flags [P.], seq 1:488, ack 945, win 119, length 487: HTTP: HTTP/1.1 200 OK
13:08:50.470176 40:61:86:04:49:22 > 00:1a:8c:71:57:4d, ethertype IPv4 (0x0800), length 54: 192.168.3.131.55950 > 72.14.213.0.80: Flags [R.], seq 946, ack 488, win 0, length 0
13:08:50.474121 00:1a:8c:71:57:4d > 40:61:86:04:49:22, ethertype IPv4 (0x0800), length 60: 72.14.213.0.80 > 192.168.3.131.55950: Flags [F.], seq 488, ack 946, win 119, length 0
13:08:50.635792 40:61:86:04:49:22 > 00:1a:8c:71:57:4d, ethertype IPv4 (0x0800), length 66: 192.168.3.131.52152 > 72.14.213.127.443: Flags [S], seq 416920696, win 8192, options [mss 1460,nop,wscale 2,nop,nop,sackOK], length 0
13:08:50.653187 00:1a:8c:71:57:4d > 40:61:86:04:49:22, ethertype IPv4 (0x0800), length 66: 72.14.213.127.443 > 192.168.3.131.52152: Flags [S.], seq 4005169627, ack 416920697, win 5720, options [mss 1430,nop,nop,sackOK,nop,wscale 6], length 0
13:08:50.656923 40:61:86:04:49:22 > 00:1a:8c:71:57:4d, ethertype IPv4 (0x0800), length 54: 192.168.3.131.52152 > 72.14.213.127.443: Flags [.], ack 1, win 16445, length 0
13:08:50.658032 40:61:86:04:49:22 > 00:1a:8c:71:57:4d, ethertype IPv4 (0x0800), length 231: 192.168.3.131.52152 > 72.14.213.127.443: Flags [P.], seq 1:178, ack 1, win 16445, length 177
13:08:50.674518 00:1a:8c:71:57:4d > 40:61:86:04:49:22, ethertype IPv4 (0x0800), length 60: 72.14.213.127.443 > 192.168.3.131.52152: Flags [.], ack 178, win 107, length 0
13:08:50.676374 00:1a:8c:71:57:4d > 40:61:86:04:49:22, ethertype IPv4 (0x0800), length 1484: 72.14.213.127.443 > 192.168.3.131.52152: Flags [.], seq 1:1431, ack 178, win 107, length 1430
13:08:50.678570 00:1a:8c:71:57:4d > 40:61:86:04:49:22, ethertype IPv4 (0x0800), length 345: 72.14.213.127.443 > 192.168.3.131.52152: Flags [P.], seq 1431:1722, ack 178, win 107, length 291
13:08:50.680771 40:61:86:04:49:22 > 00:1a:8c:71:57:4d, ethertype IPv4 (0x0800), length 54: 192.168.3.131.52152 > 72.14.213.127.443: Flags [.], ack 1722, win 16445, length 0
13:08:50.682693 40:61:86:04:49:22 > 00:1a:8c:71:57:4d, ethertype IPv4 (0x0800), length 329: 192.168.3.131.52152 > 72.14.213.127.443: Flags [P.], seq 178:453, ack 1722, win 16445, length 275
13:08:50.701443 00:1a:8c:71:57:4d > 40:61:86:04:49:22, ethertype IPv4 (0x0800), length 280: 72.14.213.127.443 > 192.168.3.131.52152: Flags [P.], seq 1722:1948, ack 453, win 123, length 226
13:08:50.703447 00:1a:8c:71:57:4d > 40:61:86:04:49:22, ethertype IPv4 (0x0800), length 99: 72.14.213.127.443 > 192.168.3.131.52152: Flags [P.], seq 1948:1993, ack 453, win 123, length 45
13:08:50.705590 00:1a:8c:71:57:4d > 40:61:86:04:49:22, ethertype IPv4 (0x0800), length 60: 72.14.213.127.443 > 192.168.3.131.52152: Flags [.], ack 2279, win 213, length 0
13:08:50.707660 40:61:86:04:49:22 > 00:1a:8c:71:57:4d, ethertype IPv4 (0x0800), length 54: 192.168.3.131.52152 > 72.14.213.127.443: Flags [.], ack 1993, win 16377, length 0
13:08:50.811181 40:61:86:04:49:22 > 00:1a:8c:71:57:4d, ethertype IPv4 (0x0800), length 66: 192.168.3.131.55953 > 65.55.206.209.80: Flags [S], seq 2940642208, win 8192, options [mss 1460,nop,wscale 2,nop,nop,sackOK], length 0
13:08:50.841660 00:1a:8c:71:57:4d > 40:61:86:04:49:22, ethertype IPv4 (0x0800), length 440: 72.14.213.127.443 > 192.168.3.131.52152: Flags [P.], seq 1993:2379, ack 2279, win 213, length 386
13:08:50.843814 00:1a:8c:71:57:4d > 40:61:86:04:49:22, ethertype IPv4 (0x0800), length 1484: 72.14.213.127.443 > 192.168.3.131.52152: Flags [.], seq 2379:3809, ack 2279, win 213, length 1430
13:08:50.845827 00:1a:8c:71:57:4d > 40:61:86:04:49:22, ethertype IPv4 (0x0800), length 100: 72.14.213.127.443 > 192.168.3.131.52152: Flags [P.], seq 3809:3855, ack 2279, win 213, length 46
13:08:50.856191 40:61:86:04:49:22 > 00:1a:8c:71:57:4d, ethertype IPv4 (0x0800), length 54: 192.168.3.131.52152 > 72.14.213.127.443: Flags [.], ack 3855, win 16445, length 0
13:08:50.856545 00:1a:8c:71:57:4d > 40:61:86:04:49:22, ethertype IPv4 (0x0800), length 1484: 72.14.213.127.443 > 192.168.3.131.52152: Flags [.], seq 3855:5285, ack 2279, win 213, length 1430
13:08:50.856891 00:1a:8c:71:57:4d > 40:61:86:04:49:22, ethertype IPv4 (0x0800), length 1085: 72.14.213.127.443 > 192.168.3.131.52152: Flags [P.], seq 5285:6316, ack 2279, win 213, length 1031
13:08:50.857205 40:61:86:04:49:22 > 00:1a:8c:71:57:4d, ethertype IPv4 (0x0800), length 54: 192.168.3.131.52152 > 72.14.213.127.443: Flags [.], ack 6316, win 16445, length 0
13:08:50.872394 00:1a:8c:71:57:4d > 40:61:86:04:49:22, ethertype IPv4 (0x0800), length 1484: 72.14.213.127.443 > 192.168.3.131.52152: Flags [.], seq 6316:7746, ack 2279, win 213, length 1430
13:08:50.874305 00:1a:8c:71:57:4d > 40:61:86:04:49:22, ethertype IPv4 (0x0800), length 100: 72.14.213.127.443 > 192.168.3.131.52152: Flags [P.], seq 7746:7792, ack 2279, win 213, length 46
13:08:50.876151 40:61:86:04:49:22 > 00:1a:8c:71:57:4d, ethertype IPv4 (0x0800), length 54: 192.168.3.131.52152 > 72.14.213.127.443: Flags [.], ack 7792, win 16445, length 0
13:08:50.877874 00:1a:8c:71:57:4d > 40:61:86:04:49:22, ethertype IPv4 (0x0800), length 1484: 72.14.213.127.443 > 192.168.3.131.52152: Flags [.], seq 7792:9222, ack 2279, win 213, length 1430
13:08:50.879545 00:1a:8c:71:57:4d > 40:61:86:04:49:22, ethertype IPv4 (0x0800), length 684: 72.14.213.127.443 > 192.168.3.131.52152: Flags [P.], seq 9222:9852, ack 2279, win 213, length 630
13:08:50.883828 40:61:86:04:49:22 > 00:1a:8c:71:57:4d, ethertype IPv4 (0x0800), length 54: 192.168.3.131.52152 > 72.14.213.127.443: Flags [.], ack 9852, win 16445, length 0
13:08:50.884193 00:1a:8c:71:57:4d > 40:61:86:04:49:22, ethertype IPv4 (0x0800), length 1484: 72.14.213.127.443 > 192.168.3.131.52152: Flags [.], seq 9852:11282, ack 2279, win 213, length 1430
13:08:50.886591 00:1a:8c:71:57:4d > 40:61:86:04:49:22, ethertype IPv4 (0x0800), length 1484: 72.14.213.127.443 > 192.168.3.131.52152: Flags [.], seq 11282:12712, ack 2279, win 213, length 1430
13:08:50.889160 00:1a:8c:71:57:4d > 40:61:86:04:49:22, ethertype IPv4 (0x0800), length 198: 72.14.213.127.443 > 192.168.3.131.52152: Flags [P.], seq 12712:12856, ack 2279, win 213, length 144
13:08:50.892352 40:61:86:04:49:22 > 00:1a:8c:71:57:4d, ethertype IPv4 (0x0800), length 54: 192.168.3.131.52152 > 72.14.213.127.443: Flags [.], ack 12856, win 16445, length 0
13:08:50.893790 00:1a:8c:71:57:4d > 40:61:86:04:49:22, ethertype IPv4 (0x0800), length 863: 72.14.213.127.443 > 192.168.3.131.52152: Flags [P.], seq 12856:13665, ack 2279, win 213, length 809
13:08:50.899278 00:1a:8c:71:57:4d > 40:61:86:04:49:22, ethertype IPv4 (0x0800), length 60: 65.55.206.209.80 > 192.168.3.131.55953: Flags [S.], seq 828418081, ack 2940642209, win 8190, options [mss 1460], length 0
13:08:50.899603 40:61:86:04:49:22 > 00:1a:8c:71:57:4d, ethertype IPv4 (0x0800), length 54: 192.168.3.131.55953 > 65.55.206.209.80: Flags [.], ack 1, win 64240, length 0
13:08:50.899945 40:61:86:04:49:22 > 00:1a:8c:71:57:4d, ethertype IPv4 (0x0800), length 515: 192.168.3.131.55953 > 65.55.206.209.80: Flags [P.], seq 1:462, ack 1, win 64240, length 461: HTTP: GET / HTTP/1.1
13:08:50.901637 40:61:86:04:49:22 > 00:1a:8c:71:57:4d, ethertype IPv4 (0x0800), length 303: 192.168.3.131.52152 > 72.14.213.127.443: Flags [P.], seq 2279:2528, ack 13665, win 16242, length 249
13:08:50.918583 00:1a:8c:71:57:4d > 40:61:86:04:49:22, ethertype IPv4 (0x0800), length 1484: 72.14.213.127.443 > 192.168.3.131.52152: Flags [.], seq 13665:15095, ack 2279, win 213, length 1430
13:08:50.920800 00:1a:8c:71:57:4d > 40:61:86:04:49:22, ethertype IPv4 (0x0800), length 1484: 72.14.213.127.443 > 192.168.3.131.52152: Flags [.], seq 15095:16525, ack 2279, win 213, length 1430
13:08:50.922707 00:1a:8c:71:57:4d > 40:61:86:04:49:22, ethertype IPv4 (0x0800), length 173: 72.14.213.127.443 > 192.168.3.131.52152: Flags [P.], seq 16525:16644, ack 2279, win 213, length 119
13:08:50.926350 40:61:86:04:49:22 > 00:1a:8c:71:57:4d, ethertype IPv4 (0x0800), length 54: 192.168.3.131.52152 > 72.14.213.127.443: Flags [.], ack 16644, win 16445, length 0
13:08:50.927330 00:1a:8c:71:57:4d > 40:61:86:04:49:22, ethertype IPv4 (0x0800), length 1484: 72.14.213.127.443 > 192.168.3.131.52152: Flags [.], seq 16644:18074, ack 2279, win 213, length 1430
13:08:50.930333 00:1a:8c:71:57:4d > 40:61:86:04:49:22, ethertype IPv4 (0x0800), length 1484: 72.14.213.127.443 > 192.168.3.131.52152: Flags [.], seq 18074:19504, ack 2279, win 213, length 1430
13:08:50.931379 40:61:86:04:49:22 > 00:1a:8c:71:57:4d, ethertype IPv4 (0x0800), length 54: 192.168.3.131.52152 > 72.14.213.127.443: Flags [.], ack 19504, win 16445, length 0
13:08:50.933308 00:1a:8c:71:57:4d > 40:61:86:04:49:22, ethertype IPv4 (0x0800), length 1391: 72.14.213.127.443 > 192.168.3.131.52152: Flags [P.], seq 19504:20841, ack 2279, win 213, length 1337
13:08:50.936387 00:1a:8c:71:57:4d > 40:61:86:04:49:22, ethertype IPv4 (0x0800), length 1484: 72.14.213.127.443 > 192.168.3.131.52152: Flags [.], seq 20841:22271, ack 2279, win 213, length 1430
13:08:50.938334 00:1a:8c:71:57:4d > 40:61:86:04:49:22, ethertype IPv4 (0x0800), length 1484: 72.14.213.127.443 > 192.168.3.131.52152: Flags [.], seq 22271:23701, ack 2279, win 213, length 1430
13:08:50.940327 00:1a:8c:71:57:4d > 40:61:86:04:49:22, ethertype IPv4 (0x0800), length 131: 72.14.213.127.443 > 192.168.3.131.52152: Flags [P.], seq 23701:23778, ack 2279, win 213, length 77
13:08:50.944401 40:61:86:04:49:22 > 00:1a:8c:71:57:4d, ethertype IPv4 (0x0800), length 54: 192.168.3.131.52152 > 72.14.213.127.443: Flags [.], ack 23778, win 16445, length 0
13:08:50.944737 00:1a:8c:71:57:4d > 40:61:86:04:49:22, ethertype IPv4 (0x0800), length 1298: 72.14.213.127.443 > 192.168.3.131.52152: Flags [P.], seq 23778:25022, ack 2279, win 213, length 1244
13:08:50.947881 00:1a:8c:71:57:4d > 40:61:86:04:49:22, ethertype IPv4 (0x0800), length 135: 72.14.213.127.443 > 192.168.3.131.52152: Flags [P.], seq 25022:25103, ack 2528, win 257, length 81
13:08:50.951225 40:61:86:04:49:22 > 00:1a:8c:71:57:4d, ethertype IPv4 (0x0800), length 54: 192.168.3.131.52152 > 72.14.213.127.443: Flags [.], ack 25103, win 16113, length 0
13:08:50.951556 00:1a:8c:71:57:4d > 40:61:86:04:49:22, ethertype IPv4 (0x0800), length 87: 72.14.213.127.443 > 192.168.3.131.52152: Flags [P.], seq 25103:25136, ack 2528, win 257, length 33
13:08:50.973681 40:61:86:04:49:22 > 00:1a:8c:71:57:4d, ethertype IPv4 (0x0800), length 999: 192.168.3.131.57011 > 72.14.213.160.80: Flags [P.], seq 943:1888, ack 387, win 16192, length 945: HTTP: GET /complete/search?client=chrome&hl=en-US&q=crai HTTP/1.1
13:08:50.975114 00:1a:8c:71:57:4d > 40:61:86:04:49:22, ethertype IPv4 (0x0800), length 350: 65.55.206.209.80 > 192.168.3.131.55953: Flags [P.], seq 1:297, ack 462, win 65535, length 296: HTTP: HTTP/1.1 301 Moved Permanently
13:08:51.009963 00:1a:8c:71:57:4d > 40:61:86:04:49:22, ethertype IPv4 (0x0800), length 523: 72.14.213.160.80 > 192.168.3.131.57011: Flags [P.], seq 387:856, ack 1888, win 980, length 469: HTTP: HTTP/1.1 200 OK
13:08:51.012367 00:1a:8c:71:57:4d > 40:61:86:04:49:22, ethertype IPv4 (0x0800), length 60: 72.14.213.127.443 > 192.168.3.131.52152: Flags [.], ack 4468, win 347, length 0
13:08:51.045146 40:61:86:04:49:22 > 00:1a:8c:71:57:4d, ethertype IPv4 (0x0800), length 66: 192.168.3.131.55954 > 65.55.17.37.80: Flags [S], seq 3593671793, win 8192, options [mss 1460,nop,wscale 2,nop,nop,sackOK], length 0
13:08:51.051082 00:1a:8c:71:57:4d > 40:61:86:04:49:22, ethertype IPv4 (0x0800), length 60: 72.14.213.127.443 > 192.168.3.131.52152: Flags [.], ack 6494, win 436, length 0
13:08:51.062432 00:1a:8c:71:57:4d > 40:61:86:04:49:22, ethertype IPv4 (0x0800), length 60: 65.55.17.37.80 > 192.168.3.131.55954: Flags [S.], seq 443432526, ack 3593671794, win 8190, options [mss 1460], length 0
13:08:51.063618 40:61:86:04:49:22 > 00:1a:8c:71:57:4d, ethertype IPv4 (0x0800), length 54: 192.168.3.131.55954 > 65.55.17.37.80: Flags [.], ack 1, win 64240, length 0
13:08:51.065145 40:61:86:04:49:22 > 00:1a:8c:71:57:4d, ethertype IPv4 (0x0800), length 653: 192.168.3.131.55954 > 65.55.17.37.80: Flags [P.], seq 1:600, ack 1, win 64240, length 599: HTTP: GET / HTTP/1.1
13:08:51.095817 00:1a:8c:71:57:4d > 40:61:86:04:49:22, ethertype IPv4 (0x0800), length 1514: 65.55.17.37.80 > 192.168.3.131.55954: Flags [.], seq 1:1461, ack 600, win 8190, length 1460: HTTP: HTTP/1.1 200 OK
13:08:51.098495 00:1a:8c:71:57:4d > 40:61:86:04:49:22, ethertype IPv4 (0x0800), length 1514: 65.55.17.37.80 > 192.168.3.131.55954: Flags [.], seq 1461:2921, ack 600, win 8190, length 1460: HTTP
13:08:51.099485 40:61:86:04:49:22 > 00:1a:8c:71:57:4d, ethertype IPv4 (0x0800), length 54: 192.168.3.131.55954 > 65.55.17.37.80: Flags [.], ack 2921, win 64240, length 0
13:08:51.101255 00:1a:8c:71:57:4d > 40:61:86:04:49:22, ethertype IPv4 (0x0800), length 1514: 65.55.17.37.80 > 192.168.3.131.55954: Flags [.], seq 2921:4381, ack 600, win 8190, length 1460: HTTP
13:08:51.104984 00:1a:8c:71:57:4d > 40:61:86:04:49:22, ethertype IPv4 (0x0800), length 1514: 65.55.17.37.80 > 192.168.3.131.55954: Flags [.], seq 4381:5841, ack 600, win 8190, length 1460: HTTP
13:08:51.105368 40:61:86:04:49:22 > 00:1a:8c:71:57:4d, ethertype IPv4 (0x0800), length 54: 192.168.3.131.55954 > 65.55.17.37.80: Flags [.], ack 5841, win 64240, length 0
13:08:51.115819 00:1a:8c:71:57:4d > 40:61:86:04:49:22, ethertype IPv4 (0x0800), length 1514: 65.55.17.37.80 > 192.168.3.131.55954: Flags [.], seq 5841:7301, ack 600, win 8190, length 1460: HTTP
13:08:51.117319 00:1a:8c:71:57:4d > 40:61:86:04:49:22, ethertype IPv4 (0x0800), length 1514: 65.55.17.37.80 > 192.168.3.131.55954: Flags [.], seq 7301:8761, ack 600, win 8190, length 1460: HTTP
13:08:51.119636 00:1a:8c:71:57:4d > 40:61:86:04:49:22, ethertype IPv4 (0x0800), length 1514: 65.55.17.37.80 > 192.168.3.131.55954: Flags [.], seq 8761:10221, ack 600, win 8190, length 1460: HTTP
13:08:51.121819 40:61:86:04:49:22 > 00:1a:8c:71:57:4d, ethertype IPv4 (0x0800), length 54: 192.168.3.131.55954 > 65.55.17.37.80: Flags [.], ack 10221, win 64240, length 0
13:08:51.124417 00:1a:8c:71:57:4d > 40:61:86:04:49:22, ethertype IPv4 (0x0800), length 1514: 65.55.17.37.80 > 192.168.3.131.55954: Flags [.], seq 10221:11681, ack 600, win 8190, length 1460: HTTP
13:08:51.125277 00:1a:8c:71:57:4d > 40:61:86:04:49:22, ethertype IPv4 (0x0800), length 1514: 65.55.17.37.80 > 192.168.3.131.55954: Flags [.], seq 11681:13141, ack 600, win 8190, length 1460: HTTP
13:08:51.126926 40:61:86:04:49:22 > 00:1a:8c:71:57:4d, ethertype IPv4 (0x0800), length 54: 192.168.3.131.55954 > 65.55.17.37.80: Flags [.], ack 13141, win 64240, length 0
13:08:51.128591 00:1a:8c:71:57:4d > 40:61:86:04:49:22, ethertype IPv4 (0x0800), length 1514: 65.55.17.37.80 > 192.168.3.131.55954: Flags [P.], seq 13141:14601, ack 600, win 8190, length 1460: HTTP
13:08:51.130106 00:1a:8c:71:57:4d > 40:61:86:04:49:22, ethertype IPv4 (0x0800), length 1514: 65.55.17.37.80 > 192.168.3.131.55954: Flags [.], seq 14601:16061, ack 600, win 8190, length 1460: HTTP
13:08:51.133767 00:1a:8c:71:57:4d > 40:61:86:04:49:22, ethertype IPv4 (0x0800), length 1514: 65.55.17.37.80 > 192.168.3.131.55954: Flags [.], seq 16061:17521, ack 600, win 8190, length 1460: HTTP
13:08:51.134070 40:61:86:04:49:22 > 00:1a:8c:71:57:4d, ethertype IPv4 (0x0800), length 54: 192.168.3.131.55954 > 65.55.17.37.80: Flags [.], ack 17521, win 64240, length 0
13:08:51.136352 00:1a:8c:71:57:4d > 40:61:86:04:49:22, ethertype IPv4 (0x0800), length 1514: 65.55.17.37.80 > 192.168.3.131.55954: Flags [.], seq 17521:18981, ack 600, win 8190, length 1460: HTTP
13:08:51.137629 00:1a:8c:71:57:4d > 40:61:86:04:49:22, ethertype IPv4 (0x0800), length 1514: 65.55.17.37.80 > 192.168.3.131.55954: Flags [.], seq 18981:20441, ack 600, win 8190, length 1460: HTTP
13:08:51.139164 00:1a:8c:71:57:4d > 40:61:86:04:49:22, ethertype IPv4 (0x0800), length 1514: 65.55.17.37.80 > 192.168.3.131.55954: Flags [.], seq 20441:21901, ack 600, win 8190, length 1460: HTTP
13:08:51.142270 00:1a:8c:71:57:4d > 40:61:86:04:49:22, ethertype IPv4 (0x0800), length 1455: 65.55.17.37.80 > 192.168.3.131.55954: Flags [P.], seq 21901:23302, ack 600, win 8190, length 1401: HTTP
13:08:51.143219 40:61:86:04:49:22 > 00:1a:8c:71:57:4d, ethertype IPv4 (0x0800), length 54: 192.168.3.131.55954 > 65.55.17.37.80: Flags [.], ack 23302, win 64240, length 0
13:08:51.147406 00:1a:8c:71:57:4d > 40:61:86:04:49:22, ethertype IPv4 (0x0800), length 132: 72.14.213.127.443 > 192.168.3.131.52152: Flags [P.], seq 25136:25214, ack 6494, win 436, length 78
13:08:51.149197 00:1a:8c:71:57:4d > 40:61:86:04:49:22, ethertype IPv4 (0x0800), length 1369: 72.14.213.127.443 > 192.168.3.131.52152: Flags [P.], seq 25214:26529, ack 6494, win 436, length 1315
13:08:51.150367 40:61:86:04:49:22 > 00:1a:8c:71:57:4d, ethertype IPv4 (0x0800), length 54: 192.168.3.131.52152 > 72.14.213.127.443: Flags [.], ack 26529, win 16445, length 0
13:08:51.170517 40:61:86:04:49:22 > 00:1a:8c:71:57:4d, ethertype IPv4 (0x0800), length 66: 192.168.3.131.55955 > 207.46.148.38.80: Flags [S], seq 690488054, win 8192, options [mss 1460,nop,wscale 2,nop,nop,sackOK], length 0
13:08:51.175299 40:61:86:04:49:22 > 00:1a:8c:71:57:4d, ethertype IPv4 (0x0800), length 54: 192.168.3.131.55953 > 65.55.206.209.80: Flags [.], ack 297, win 63944, length 0
13:08:51.181521 00:1a:8c:71:57:4d > 40:61:86:04:49:22, ethertype IPv4 (0x0800), length 113: 72.14.213.127.443 > 192.168.3.131.52152: Flags [P.], seq 26529:26588, ack 6494, win 436, length 59
13:08:51.183116 00:1a:8c:71:57:4d > 40:61:86:04:49:22, ethertype IPv4 (0x0800), length 845: 72.14.213.127.443 > 192.168.3.131.52152: Flags [P.], seq 26588:27379, ack 6494, win 436, length 791
13:08:51.185220 40:61:86:04:49:22 > 00:1a:8c:71:57:4d, ethertype IPv4 (0x0800), length 54: 192.168.3.131.52152 > 72.14.213.127.443: Flags [.], ack 27379, win 16232, length 0
13:08:51.187173 00:1a:8c:71:57:4d > 40:61:86:04:49:22, ethertype IPv4 (0x0800), length 62: 207.46.148.38.80 > 192.168.3.131.55955: Flags [S.], seq 3974155008, ack 690488055, win 8192, options [mss 1460,nop,nop,sackOK], length 0
13:08:51.188473 40:61:86:04:49:22 > 00:1a:8c:71:57:4d, ethertype IPv4 (0x0800), length 54: 192.168.3.131.55955 > 207.46.148.38.80: Flags [.], ack 1, win 64240, length 0
13:08:51.190069 40:61:86:04:49:22 > 00:1a:8c:71:57:4d, ethertype IPv4 (0x0800), length 502: 192.168.3.131.55955 > 207.46.148.38.80: Flags [P.], seq 1:449, ack 1, win 64240, length 448: HTTP: GET /action/MMN_Homepage HTTP/1.1
13:08:51.200194 00:1a:8c:71:57:4d > 40:61:86:04:49:22, ethertype IPv4 (0x0800), length 333: 207.46.148.38.80 > 192.168.3.131.55955: Flags [FP.], seq 1:280, ack 449, win 64240, length 279: HTTP: HTTP/1.1 200 OK
13:08:51.203332 40:61:86:04:49:22 > 00:1a:8c:71:57:4d, ethertype IPv4 (0x0800), length 54: 192.168.3.131.55955 > 207.46.148.38.80: Flags [.], ack 281, win 63961, length 0
13:08:51.203737 40:61:86:04:49:22 > 00:1a:8c:71:57:4d, ethertype IPv4 (0x0800), length 54: 192.168.3.131.55955 > 207.46.148.38.80: Flags [F.], seq 449, ack 281, win 63961, length 0
13:08:51.205238 40:61:86:04:49:22 > 00:1a:8c:71:57:4d, ethertype IPv4 (0x0800), length 66: 192.168.3.131.55956 > 66.235.139.121.80: Flags [S], seq 1815278486, win 8192, options [mss 1460,nop,wscale 2,nop,nop,sackOK], length 0
13:08:51.208709 40:61:86:04:49:22 > 00:1a:8c:71:57:4d, ethertype IPv4 (0x0800), length 54: 192.168.3.131.57011 > 72.14.213.160.80: Flags [.], ack 856, win 16445, length 0
13:08:51.220322 40:61:86:04:49:22 > 00:1a:8c:71:57:4d, ethertype IPv4 (0x0800), length 120: 192.168.3.131.52152 > 72.14.213.127.443: Flags [P.], seq 8378:8444, ack 27379, win 16232, length 66
13:08:51.224231 00:1a:8c:71:57:4d > 40:61:86:04:49:22, ethertype IPv4 (0x0800), length 60: 207.46.148.38.80 > 192.168.3.131.55955: Flags [.], ack 450, win 64240, length 0
13:08:51.226148 40:61:86:04:49:22 > 00:1a:8c:71:57:4d, ethertype IPv4 (0x0800), length 66: 192.168.3.131.55957 > 65.55.5.232.80: Flags [S], seq 2391001289, win 8192, options [mss 1460,nop,wscale 2,nop,nop,sackOK], length 0
13:08:51.227583 40:61:86:04:49:22 > 00:1a:8c:71:57:4d, ethertype IPv4 (0x0800), length 66: 192.168.3.131.55958 > 65.55.239.163.80: Flags [S], seq 1749696983, win 8192, options [mss 1460,nop,wscale 2,nop,nop,sackOK], length 0
13:08:51.236282 00:1a:8c:71:57:4d > 40:61:86:04:49:22, ethertype IPv4 (0x0800), length 66: 66.235.139.121.80 > 192.168.3.131.55956: Flags [S.], seq 3948468093, ack 1815278487, win 4380, options [mss 1460,nop,wscale 0,sackOK,eol], length 0
13:08:51.237779 40:61:86:04:49:22 > 00:1a:8c:71:57:4d, ethertype IPv4 (0x0800), length 54: 192.168.3.131.55956 > 66.235.139.121.80: Flags [.], ack 1, win 16425, length 0
13:08:51.239234 40:61:86:04:49:22 > 00:1a:8c:71:57:4d, ethertype IPv4 (0x0800), length 1107: 192.168.3.131.55956 > 66.235.139.121.80: Flags [P.], seq 1:1054, ack 1, win 16425, length 1053: HTTP: GET /b/ss/msnportalhomepagecaen/1/H.7-pdv-2/s84495919100008?[AQB]&ndh=1&t=25%2F0%2F2011%2010%3A52%3A23%202%20480&ns=msnportal&pageName=MSN%20CanadaMSFTW&g=http%3A%2F%2Fca.msn.com%2F&r=&s=1680x1050&c=32&k=Y&bw=1680&bh=949&hp=N&ch=&server=msn.com&c1=Portal&v1=1%2F2011&c2=en-ca&v2=1%2F25%2F2011&c3=12.0&c19=Dblu%2CW1%2CQ1%2C4.0&c22=True&c29=http%3A%2F%2Fca.msn.com%2F&c4=&cc=USD&ct=lan&v=Y&j=1.3&[AQE] HTTP/1.1
13:08:51.240984 00:1a:8c:71:57:4d > 40:61:86:04:49:22, ethertype IPv4 (0x0800), length 60: 72.14.213.127.443 > 192.168.3.131.52152: Flags [.], ack 8378, win 526, length 0
13:08:51.244578 40:61:86:04:49:22 > 00:1a:8c:71:57:4d, ethertype IPv4 (0x0800), length 309: 192.168.3.131.52152 > 72.14.213.127.443: Flags [P.], seq 8444:8699, ack 27379, win 16232, length 255
13:08:51.246004 00:1a:8c:71:57:4d > 40:61:86:04:49:22, ethertype IPv4 (0x0800), length 60: 65.55.5.232.80 > 192.168.3.131.55957: Flags [S.], seq 3981672661, ack 2391001290, win 8190, options [mss 1460], length 0
13:08:51.247435 40:61:86:04:49:22 > 00:1a:8c:71:57:4d, ethertype IPv4 (0x0800), length 54: 192.168.3.131.55957 > 65.55.5.232.80: Flags [.], ack 1, win 64240, length 0
13:08:51.248963 40:61:86:04:49:22 > 00:1a:8c:71:57:4d, ethertype IPv4 (0x0800), length 701: 192.168.3.131.55957 > 65.55.5.232.80: Flags [P.], seq 1:648, ack 1, win 64240, length 647: HTTP: GET /ADSAdClient31.dll?GetSAd=&DPJS=0&PN=MSFT&PG=CAE9TX&AP=1389 HTTP/1.1
13:08:51.263372 00:1a:8c:71:57:4d > 40:61:86:04:49:22, ethertype IPv4 (0x0800), length 60: 72.14.213.127.443 > 192.168.3.131.52152: Flags [.], ack 8699, win 570, length 0
13:08:51.265012 00:1a:8c:71:57:4d > 40:61:86:04:49:22, ethertype IPv4 (0x0800), length 1066: 65.55.5.232.80 > 192.168.3.131.55957: Flags [P.], seq 1:1013, ack 648, win 8190, length 1012: HTTP: HTTP/1.1 200 OK
13:08:51.273348 00:1a:8c:71:57:4d > 40:61:86:04:49:22, ethertype IPv4 (0x0800), length 734: 66.235.139.121.80 > 192.168.3.131.55956: Flags [P.], seq 1:681, ack 1054, win 5433, length 680: HTTP: HTTP/1.1 302 Found
13:08:51.306193 00:1a:8c:71:57:4d > 40:61:86:04:49:22, ethertype IPv4 (0x0800), length 60: 65.55.239.163.80 > 192.168.3.131.55958: Flags [S.], seq 1741890931, ack 1749696984, win 8190, options [mss 1460], length 0
13:08:51.307661 40:61:86:04:49:22 > 00:1a:8c:71:57:4d, ethertype IPv4 (0x0800), length 54: 192.168.3.131.55958 > 65.55.239.163.80: Flags [.], ack 1, win 64240, length 0
13:08:51.309144 40:61:86:04:49:22 > 00:1a:8c:71:57:4d, ethertype IPv4 (0x0800), length 632: 192.168.3.131.55958 > 65.55.239.163.80: Flags [P.], seq 1:579, ack 1, win 64240, length 578: HTTP: GET /c.gif?di=210&pi=11654&ps=10274&tp=http://ca.msn.com/ca.msn.com/default.aspxW&rf= HTTP/1.1
13:08:51.310987 00:1a:8c:71:57:4d > 40:61:86:04:49:22, ethertype IPv4 (0x0800), length 176: 72.14.213.127.443 > 192.168.3.131.52152: Flags [P.], seq 27379:27501, ack 8699, win 570, length 122
13:08:51.312731 00:1a:8c:71:57:4d > 40:61:86:04:49:22, ethertype IPv4 (0x0800), length 87: 72.14.213.127.443 > 192.168.3.131.52152: Flags [P.], seq 27501:27534, ack 8699, win 570, length 33
13:08:51.314342 40:61:86:04:49:22 > 00:1a:8c:71:57:4d, ethertype IPv4 (0x0800), length 54: 192.168.3.131.52152 > 72.14.213.127.443: Flags [.], ack 27534, win 16193, length 0
13:08:51.315748 40:61:86:04:49:22 > 00:1a:8c:71:57:4d, ethertype IPv4 (0x0800), length 66: 192.168.3.131.55959 > 65.55.5.231.80: Flags [S], seq 892852360, win 8192, options [mss 1460,nop,wscale 2,nop,nop,sackOK], length 0
13:08:51.329203 00:1a:8c:71:57:4d > 40:61:86:04:49:22, ethertype IPv4 (0x0800), length 60: 65.55.5.231.80 > 192.168.3.131.55959: Flags [S.], seq 611666840, ack 892852361, win 8190, options [mss 1460], length 0
13:08:51.330630 40:61:86:04:49:22 > 00:1a:8c:71:57:4d, ethertype IPv4 (0x0800), length 54: 192.168.3.131.55959 > 65.55.5.231.80: Flags [.], ack 1, win 64240, length 0
13:08:51.332013 40:61:86:04:49:22 > 00:1a:8c:71:57:4d, ethertype IPv4 (0x0800), length 703: 192.168.3.131.55959 > 65.55.5.231.80: Flags [P.], seq 1:650, ack 1, win 64240, length 649: HTTP: GET /ADSAdClient31.dll?GetSAd=&DPJS=0&PN=MSFT&PG=CAE9UT&AP=1440 HTTP/1.1
13:08:51.348928 00:1a:8c:71:57:4d > 40:61:86:04:49:22, ethertype IPv4 (0x0800), length 1066: 65.55.5.231.80 > 192.168.3.131.55959: Flags [P.], seq 1:1013, ack 650, win 8190, length 1012: HTTP: HTTP/1.1 200 OK
13:08:51.354495 00:1a:8c:71:57:4d > 40:61:86:04:49:22, ethertype IPv4 (0x0800), length 110: 72.14.213.127.443 > 192.168.3.131.52152: Flags [P.], seq 27534:27590, ack 8699, win 570, length 56
13:08:51.356086 00:1a:8c:71:57:4d > 40:61:86:04:49:22, ethertype IPv4 (0x0800), length 514: 72.14.213.127.443 > 192.168.3.131.52152: Flags [P.], seq 27590:28050, ack 8699, win 570, length 460
13:08:51.357692 40:61:86:04:49:22 > 00:1a:8c:71:57:4d, ethertype IPv4 (0x0800), length 54: 192.168.3.131.52152 > 72.14.213.127.443: Flags [.], ack 28050, win 16445, length 0
13:08:51.361370 40:61:86:04:49:22 > 00:1a:8c:71:57:4d, ethertype IPv4 (0x0800), length 66: 192.168.3.131.55960 > 206.108.207.139.80: Flags [S], seq 2585327780, win 8192, options [mss 1460,nop,wscale 2,nop,nop,sackOK], length 0
13:08:51.368331 40:61:86:04:49:22 > 00:1a:8c:71:57:4d, ethertype IPv4 (0x0800), length 66: 192.168.3.131.55961 > 184.24.133.32.80: Flags [S], seq 690534209, win 8192, options [mss 1460,nop,wscale 2,nop,nop,sackOK], length 0
13:08:51.371198 00:1a:8c:71:57:4d > 40:61:86:04:49:22, ethertype IPv4 (0x0800), length 66: 206.108.207.139.80 > 192.168.3.131.55960: Flags [S.], seq 2754106271, ack 2585327781, win 5840, options [mss 1460,nop,nop,sackOK,nop,wscale 5], length 0
13:08:51.372615 40:61:86:04:49:22 > 00:1a:8c:71:57:4d, ethertype IPv4 (0x0800), length 54: 192.168.3.131.55960 > 206.108.207.139.80: Flags [.], ack 1, win 16425, length 0
13:08:51.374034 40:61:86:04:49:22 > 00:1a:8c:71:57:4d, ethertype IPv4 (0x0800), length 565: 192.168.3.131.55960 > 206.108.207.139.80: Flags [P.], seq 1:512, ack 1, win 16425, length 511: HTTP: GET /r?c2=3000001&d.c=gif&d.o=msnportalhomepagecaen&d.x=184063711&d.t=page&d.u=http%3A%2F%2Fca.msn.com%2F HTTP/1.1
13:08:51.380605 00:1a:8c:71:57:4d > 40:61:86:04:49:22, ethertype IPv4 (0x0800), length 60: 206.108.207.139.80 > 192.168.3.131.55960: Flags [.], ack 512, win 216, length 0
13:08:51.382093 00:1a:8c:71:57:4d > 40:61:86:04:49:22, ethertype IPv4 (0x0800), length 576: 206.108.207.139.80 > 192.168.3.131.55960: Flags [P.], seq 1:523, ack 512, win 216, length 522: HTTP: HTTP/1.1 200 OK
13:08:51.383716 00:1a:8c:71:57:4d > 40:61:86:04:49:22, ethertype IPv4 (0x0800), length 66: 184.24.133.32.80 > 192.168.3.131.55961: Flags [S.], seq 3519670384, ack 690534210, win 5840, options [mss 1460,nop,nop,sackOK,nop,wscale 5], length 0
13:08:51.385234 40:61:86:04:49:22 > 00:1a:8c:71:57:4d, ethertype IPv4 (0x0800), length 54: 192.168.3.131.55961 > 184.24.133.32.80: Flags [.], ack 1, win 16425, length 0
13:08:51.386829 40:61:86:04:49:22 > 00:1a:8c:71:57:4d, ethertype IPv4 (0x0800), length 758: 192.168.3.131.55961 > 184.24.133.32.80: Flags [P.], seq 1:705, ack 1, win 16425, length 704: HTTP: GET /scripts/beacon.dll?c1=2&c2=2128&c3=&c4=&c5=&c6=&c7=http%3A//ca.msn.com/&c8=MSN%20Canada%20-%20The%20home%20of%20world-class%20services%20such%20as%20Hotmail%2C%20Windows%20Live%20Messenger%2C%20and%20News%2C%20Sports%2C%20Financial%20and%20Entertainment&c9=&c10=1680x1050&rn=1295981543432 HTTP/1.1

